{
  "$schema": "../schemas/hotel-booking-verification.schema.json",
  "identity": {
    "informationUuidV5": "913faf6f-78d4-581c-8eca-900110effb30",
    "observationUuidV7": "01a04ccd-b75f-70e6-a355-3e8cba3ab3b7"
  },
  "observedAt": "2026-08-29T09:15:45.375Z",
  "sourceCommit": "51fdc38fa4c4cf9d66473bdb22f35ecb93a444cf",
  "sourceState": "DEPLOYED_CURRENT",
  "artifactDigest": "06a753e5cd240eebd0663c57031a0993e87cbb87c7d61401eb220dbacd91e132",
  "artifactDigestScope": {
    "algorithm": "SHA-256",
    "root": "dist/client",
    "canonicalization": "LEXICOGRAPHIC_RELATIVE_POSIX_PATH_NUL_FILE_BYTES_NUL",
    "excludedPaths": [
      ".assetsignore",
      "service-integrations.json"
    ]
  },
  "fullClientArtifactDigest": "738ae7e306c823f4df66bd611147b0f3830cc53fb736fe561deccb6bb02378a7",
  "fullClientArtifactDigestScope": {
    "algorithm": "SHA-256",
    "root": "dist/client",
    "canonicalization": "LEXICOGRAPHIC_RELATIVE_POSIX_PATH_NUL_FILE_BYTES_NUL",
    "excludedPaths": []
  },
  "fullSitesPackageDigest": "d7b4b43fa3c5b3530bd02aba7cf2dc0f7e1c8c8b5ee07709466fc297c213d8fa",
  "fullSitesPackageDigestScope": {
    "algorithm": "SHA-256",
    "root": "dist",
    "canonicalization": "LEXICOGRAPHIC_RELATIVE_POSIX_PATH_NUL_FILE_BYTES_NUL",
    "excludedPaths": []
  },
  "stateTransition": "PLANNED -> IMPLEMENTING -> LOCALLY_VERIFIED -> OWNER_ONLY_VERSION_3_LIVE_VERIFIED -> PUBLIC_VERSION_4_LIVE_VERIFIED -> PUBLIC_VERSION_5_SCREEN_RECORDED -> PUBLIC_VERSION_6_LIVE_VERIFIED -> PUBLIC_VERSION_7_SITES_AND_VERCEL_VERIFIED -> DEVPOST_STATE_TABLE_WORKTREE_CANDIDATE -> PUBLIC_VERSION_8_SITES_VERCEL_DEVPOST_CURRENT_VERIFIED -> PUBLIC_VERSION_8_SITES_RETRY_FLOW_VERIFIED -> YOUTUBE_PUBLIC_AND_DEVPOST_VIDEO_LINKED_FINAL_SUBMISSION_PENDING -> WORKTREE_PUBLICATION_RECORD_CANDIDATE -> SITES_VERSION_9_PUBLICATION_RECORD_DEPLOYED -> VERCEL_PUBLICATION_RECORD_REDEPLOYED -> AGGREGATE_PUBLICATION_TIMELINE_RECONCILED -> DEPENDENCY_PATCH_VERSION_10_BROWSER_RUN_VERIFIED -> DEPENDENCY_PATCH_VERSION_11_CURRENT_VERIFIED",
  "scope": "Fictional device-local hotel booking demo; no real booking, payment, email, external cancellation, or personal information.",
  "liveDeployment": {
    "functionalSourceCommit": "5ac1fe51a29800eb052f9a63e7311559b7c01e45",
    "deployedVersionSourceCommit": "51fdc38fa4c4cf9d66473bdb22f35ecb93a444cf",
    "functionalArtifactDigest": "06a753e5cd240eebd0663c57031a0993e87cbb87c7d61401eb220dbacd91e132",
    "fullSitesPackageDigest": "d7b4b43fa3c5b3530bd02aba7cf2dc0f7e1c8c8b5ee07709466fc297c213d8fa",
    "versionId": "appgprj_6a923239002081918896546134a7dc8f~appgver_40087b159eb8819197ae93e67e78a50d",
    "versionNumber": 11,
    "deploymentId": "appgdep_6a92a1cf0bb08191bbd00064ac2cdd12",
    "providerArchiveContentHash": "sha256:2c971dfc7e860e75a1e9d23bdfc185c1fc0c450cda6575757276b029cf254e40",
    "url": "https://kyoto-booking-retry-proof.anionix.chatgpt.site",
    "accessMode": "PUBLIC",
    "status": "CURRENT_ARTIFACT_VERIFIED",
    "observedAt": "2026-08-29T09:09:43.704Z",
    "evidence": "Sites version 11 and deployment readback identify commit 51fdc38fa4c4cf9d66473bdb22f35ecb93a444cf as the exact current source and match full Sites package digest d7b4b43fa3c5b3530bd02aba7cf2dc0f7e1c8c8b5ee07709466fc297c213d8fa. Anonymous requests to the public root and service-integrations.json returned HTTP 200, and the published service record matched local SHA-256 47ac2da3d4c09872a24caf6aef54246e7921b3a3e0984b3778b2c477d4dfee4c. The dependency-patched functional digest is 06a753e5cd240eebd0663c57031a0993e87cbb87c7d61401eb220dbacd91e132. A fresh version 10 browser run proved PREPARED -> COMMITTED -> RETRY_RECOGNIZED, two attempts to one booking and one effect start, four WebMCP tools, and confirmation FKR-7EF2A00FA2. Version 11 keeps the same functional digest, updates only the public service record, and restored that result after reload."
  },
  "checks": [
    {
      "checkId": "60f8e686-7399-5a51-9d99-3b4dc14aa437",
      "name": "Language-neutral UUIDv5 identity",
      "status": "PASS",
      "evidence": "Node test proves English and Japanese presentation inputs derive the same fixed-namespace UUIDv5."
    },
    {
      "checkId": "311a96f7-7859-5b7f-baf2-17e39b83502d",
      "name": "Two attempts remain one booking",
      "status": "PASS",
      "evidence": "Concurrency tests directly count one physical row in the IndexedDB bookings store. Fresh public runs on Sites version 10 and Vercel deployment dpl_4uthDyjgSi1KxbssW9t5u18xJbLs each reported attempts=2, bookings=1, effectStartCount=1, and confirmation FKR-7EF2A00FA2; the final version 11 and deployment dpl_F5TbHqiTPomnF6zzt4F3RFJHvVEe restored the same local result after reload."
    },
    {
      "checkId": "8982f898-c1da-55cd-834b-211099bc82ca",
      "name": "Exactly four non-destructive WebMCP tools",
      "status": "PASS",
      "evidence": "At https://kyoto-booking-retry-proof.anionix.chatgpt.site, the in-app browser discovered and called exactly check_existing_hotel_booking, prepare_hotel_booking, get_hotel_booking_status, and preview_hotel_cancellation. Preparation changed the matching visible request to PREPARED and enabled the separate human confirmation button; no confirmation, payment, or cancellation tool was present."
    },
    {
      "checkId": "28fd6207-3a34-5294-9a4a-305b0ac2e96d",
      "name": "Production build restores offline after first visit",
      "status": "PASS",
      "evidence": "At http://127.0.0.1:4184, a forced network-offline reload restored RETRY_RECOGNIZED, the non-default 2026-11-02 to 2026-11-07 stay, four adults, two rooms, Japanese presentation, the same confirmation, attempts=2, bookings=1, and effects=1."
    },
    {
      "checkId": "df4afa56-2019-50aa-bfec-cb5524e665f1",
      "name": "Expired preparation becomes one durable event",
      "status": "PASS",
      "evidence": "The 120-second boundary is derived as EXPIRED on a read. Page timer, restoration, or repeated preparation then persists PREPARED -> EXPIRED exactly once without a booking row or effect start."
    },
    {
      "checkId": "83cf27de-768e-5288-8496-91c52c33d0cb",
      "name": "Current price rule is rechecked before commit",
      "status": "PASS",
      "evidence": "A regression test changes both the stored quote and its stored approval digest to a 13,000-yen rule. Human confirmation rejects it against the current 12,000-yen calculation before a booking row or effect start exists."
    },
    {
      "checkId": "f29a9daa-57b2-55e3-9d87-6f518426cb5d",
      "name": "Responsive widths and control target sizes",
      "status": "PASS",
      "evidence": "Browser checks at 320, 375, 390, and 768 CSS pixels found no horizontal overflow; all tested form controls were at least 44 by 44 CSS pixels."
    },
    {
      "checkId": "6b9f51ca-d29a-572c-8544-948ef70a2c58",
      "name": "Keyboard focus traversal",
      "status": "INCONCLUSIVE",
      "evidence": "The browser-control backend focused native form elements but did not advance focus when sending Tab. Source uses native links, labels, inputs, selects, buttons, details, headings, and a skip link; an independent physical-keyboard run is still required."
    },
    {
      "checkId": "4a3b9f53-f5da-563e-89a9-8ef65a6f4d62",
      "name": "Screen-reader announcement",
      "status": "INCONCLUSIVE",
      "evidence": "ARIA labels, alert, live regions, heading order, and native controls are present; no VoiceOver or other assistive-technology session was recorded."
    },
    {
      "checkId": "6f65cf02-40eb-51c3-bdbc-4d532082fe0e",
      "name": "Google Chrome page and WebMCP runtime",
      "status": "INCONCLUSIVE",
      "evidence": "Google Chrome loaded public Sites version 6 without sign-in and displayed EMPTY, the ordinary-versus-WebMCP retry comparison, and four safe tool cards. document.modelContext was undefined, so native WebMCP discovery and execution remain inconclusive."
    },
    {
      "checkId": "cc47b03a-10b9-5806-b327-67b2139a0b93",
      "name": "Visible local proof panel",
      "status": "PASS",
      "evidence": "The public Sites version 10 run displayed reservation UUIDv5 64ccc2dc-0404-5566-b296-92d0eb7ed00f, latest event UUIDv7 01a04cc5-e895-7137-aa26-1b35ad955fc4, four events, chain head 8a47e7f03278..., and Valid after retry. Version 11 restored the same result after reload. The same panel also passed local 320 CSS-pixel wrapping without horizontal overflow."
    },
    {
      "checkId": "f7e5400d-3f70-57ef-aa97-17cab03c8915",
      "name": "Bounded source-quality toolchain",
      "status": "PASS",
      "evidence": "Pinned Oxlint 1.80.0 checks hotel JavaScript, Biome 2.5.11 checks the hotel HTML and CSS, and Oxfmt 0.65.0 checks the newly governed formatting surface. npm run quality:check completed without diagnostics; historical files outside the declared surface were not reformatted."
    },
    {
      "checkId": "e72277c5-f851-57da-a456-bfffc43f9479",
      "name": "ChatGPT Sites live execution",
      "status": "PASS",
      "evidence": "The public production URL loaded Sites version 11 anonymously from exact deployed source commit 51fdc38fa4c4cf9d66473bdb22f35ecb93a444cf. Its public root and service-integrations.json returned HTTP 200, the service record matched local SHA-256 47ac2da3d4c09872a24caf6aef54246e7921b3a3e0984b3778b2c477d4dfee4c, and the full Sites package matched digest d7b4b43fa3c5b3530bd02aba7cf2dc0f7e1c8c8b5ee07709466fc297c213d8fa. A fresh version 10 run directly proved four WebMCP tools, separate human confirmation, PREPARED -> COMMITTED -> RETRY_RECOGNIZED, 2 attempts to 1 booking and 1 effect start with confirmation FKR-7EF2A00FA2. Version 11 has the identical functional digest 06a753e5cd240eebd0663c57031a0993e87cbb87c7d61401eb220dbacd91e132 and restored the same result after reload. Final Devpost submission remains pending."
    },
    {
      "checkId": "d81f9523-0616-59e8-8bf5-46339ed98b57",